SMS Translation,SMS Language,Category,Subcategory
Use code TUE50 get Flat Rs XX off on X cab ride except Ola Share Valid in Bengaluru only for today Book Now bit.ly/ C SMS,en,Ads,promo
RPwallet Congratulations The loan have pass the check on June XX XXXX kl k link for ver advanced fiction bit.ly/2WrT6ad bit.ly/303YMKC,id,Ads,loan/gamble
ONLINE-based loan fund with X interest KSP SEJAHTERA BERSAMA provide WA interest XXXX-XXXX-XXXX,id,Ads,loan/gamble
SNS Bank Dear customer your SNS digipas be outdated Request your new digipas completely free of charge via http // www-snsbank.info/sns/inloggen,nl,Fraud,account alert
Your package have be send Please review and accept http // .. duckdns.org,de,Fraud,delivery
Your ING have be place in the quarantine zone and need to be verify again Prevent Blockade and follow the step on mijn.Ing-appactivatie.online,nl,Fraud,account alert
Dear customer your KOTAK credit card point worth INR XXXX expire by tomorrow Kindly redeem your point in cash by click here www.rewardreedem.com,en,Fraud,credit/debit card
Netflix Support We fail to verify your information Please visit N ° http // 185.163.47.190 to enter your payment information again or to use a different payment method,en,Fraud,account alert
SANTANDER For security reason we block your credit card Verify your account to activate access http // onlinesanta sms.website/ sms=santander,es,Fraud,credit/debit card
Text Message Thu XX Dec 4:00 pm Hi your account be due in X business day visit synergy.net.au/paybill use payment number XXXXXXXXXX to make payment or call I XXXX XXX XXX for assistance,en,Fraud,account alert
Ass wr.wb .... good afternoon to brother i our cooperative offer a minimum loan of X million XXX million interest X percent fast process for more info chat WhatsApp XXXXXXXXXXXX,id,Ads,loan/gamble
Dear Paytm customer your Paytm KYC have expire today immediately please contact customer care XXXXXXXXXX immediately your Paytm account block 24hrs THANKS paytm,en,Fraud,account alert
Hello friend want to share info the most complete place to learn digital business in Indonesia want immediately click http //bit.ly/traingiterbaik Good luck,id,Ads,promo
Your Canadia account have be log in To protect your right please verify to update the access device http //www.canadiad.com/,en,Fraud,account alert
protect your family from the corona virus Sensi mask Anti corona virus Price 1box Rp 50k 1dus 1.5 million How to order Chat via Wa XXXX-XXXX-XXXX,id,Ads,promo
stay prepare for emergency with up to Rs XXXXXX from Money Tap Get your pre approve Credit Line here mntp.in/PAPD2,en,Ads,promo
Your package arrive can you track it here http // zaraa.mn/track/ nlrifOo2ebu,de,Fraud,delivery
"Messages to this chat and call be now secure with end to end encryption Tap for I do n't bring you a million dollar but I can help you earn Rp 1,000,000 to 2,000,000 in XX hour but you will pay me XX of your profit after you receive the first payment of your profit when you receive it ASK ME How or message me on WhatsApp +6283103305270 For join Just save contact and click on the link below http //WA.ME/6283103305270",en,Ads,other
Your Santander account have be temporarily block for security reason to activate it you can access safely from http //t.co/uNgMxADEBE,es,Fraud,account alert
Dear customer your KOTAK BANK Debit Card point worth Rs XXXX expire by 16/06/2018 Kindly convert your point into cash by click here http //shoppepay.in/,en,Fraud,credit/debit card
"Your SIM CARD get Rp 175,000,000 Shopee poliday 7.7 PIN JZK2B59 Info click on the link s.id/info-shopeeid",id,Fraud,prize
Please confirm your credential for delivery today otherwise your package will be return to sender http //yw9.nl/ Sent from the internet,es,Fraud,delivery
This year XX s barbecue season be far from over The perfect BBQ wine with free ship all the way home to the door be here bit.ly/ 20Vmcy5,sv,Ads,promo
Kalyan s best 1BHK price rise by 3.2L after Sunday Jackpot opportunity Smart X 2BHK pwrd by Jio Fiber 29.9L raunakurbancentre.in Call02268504222 RERARg T C,en,Ads,promo
sapta last Sunday I meet you on the street you don XX t know me take a look at my photo chat-v.com/s/970033,id,Ads,other
"Your Paytm amount Rs 34,939 be credit to XXXXXXXXXX Download and Register now d1m.in/qprxmn",en,Fraud,financial
Hello In order to give you additional advantage on your bank card I will contact you shortly Your Caisse d XX Epargne STOP advisor on XXXXX,fr,Ads,promo
Congratulations to the owner of No 08138XXXXX Your number be choose as the 4th winner with pin code ijh76k79 for info check your pin at www.gebyarmkios XXX 9.blogspot.com,id,Fraud,prize
Tax authority Your outstanding debt of EUR € 471.00 with reference B1391213 have not be pay after several reminder On April XX the bailiff will proceed with a prejudgment attachment You can prevent the attachment procedure by immediately pay the entire amount via iDeal http //is.gd/8JN009,nl,Fraud,tax refund
Hi this be Donald Trump Jr The Democrats be obsess with impeach my father We CA N'T let them succeed Take a stand NOW givered.co/ Standwith Don,en,Ads,politics/election
AXIS Yes your internet package quota have be use up It XX s time for you to activate the internet package again Come check out the AXIS Internet package PROMO click http //kuota.axisnet.id Info838,id,Ads,promo
Ass kmi Offer LOAN fast amp easy process whatsapp XXXXXXXXXXXX,ms,Ads,loan/gamble
Your family member 's Jio plan have expire To continue their service recharge XXXXXXXXXX on Paytm with Rs.199 plan New User code JIO50 to get flat Rs50 cashback Existing user code JIO150 to get X voucher of upto Rs50 each T CA Recharge Now https //p.paytm.me/xCTH/JIO150S,en,Fraud,financial
"We have 25,000 transaction on your name Check here http //bit.ly/Transfer-Money",en,Fraud,financial
RM0.00 M2U Dear M2U user your account have be suspend Log on to www.maybnaks.online to complete the validation process Please make verification in the next XX hour to avoid service interruption,en,Fraud,account alert
Rabobank Your Rabo scanner be outdated Check your scanner and perform the update via http // rabo scanner.info/Rabobank/inloggen,nl,Fraud,account alert
SBI .. CUSTOMER YOUR SBI .. SAVING ACCOUNT DEBIT CARD WILL BE TEMPORARY BLOCKED ON 09/11/2019 BECAUSE DUE TO INCOMPLETE KYC .. IN YOUR BANK ACCOUNT TO REACTIVATE YOUR BANK ACCOUNT DEBIT CARD KINDLY PLEASE UPDATE YOUR FULL KYC .. IN YOUR BANK ACCOUNT IMMEDIATELY VISITING BELOW THE LINK http // docs.google.com/forms/d/e/ 1FAIpQLSd2G1gIdERRSDsh WpJrMKgmeX5G VFOCqDVD4c37NhyoN5RW g viewform,en,Fraud,account alert
BBVA 5000.00 Euro Payment pending To receive please confirm your detail http //bit.ly/2DtmgPT,es,Fraud,financial
DEAR WHATSAPP USER YOUR WHATSAPP NO HAS WON RS X CR XX LAKH IN THE WHATSAPP GLOBAL AWARD XXXX FOR CLAIM SEND NAME ADD MOBILE NO AGE JOB TO rbi USER.org.in,en,Fraud,prize
X IN X PLAN Invest Rs 4K PM and enjoy benefit like X Maturity of Rs.53 Lac X Whole Life Cover of Rs XX Lac X Pension 30K PM Click bitlyk.com/50ffau81088,en,Ads,promo
Dear Customer Rs X CRORE Loan Amount Can be Credited in Your A C under P.M MUDRA Yojana without any Documentation Submit Details txt1.in/ HqQ Odd1fKW,en,Fraud,financial
"you If yes immediately HUB XXX XXX XX to get a bonus prize of IDR 50,000 credit HUB XXX XXX XX Now",id,Ads,promo
DigiD You will receive a refund of € 684.79 euro Request your refund now via s.id/Berichten-DigiD,nl,Fraud,financial
LLOYDS BANK An attempt to pair your account on to a new device be make if this WAS N'T you visit help.device secure new auth.com,en,Fraud,account alert
UK_Gov In order to use Government Gateway Services we require further verification as you may not have verify your account with us http //utr.gov.uk.ref03.ga/ UK_Gov,en,Fraud,account alert
"the Incometax_Department require you to click the link below to submit a formal request for the payment of your unclaimed and overdue tax refund of 19,150INR http // 5.196.115.231/ITRefund",en,Fraud,tax refund
Rabobank Dear customer your debit card be outdated Request your new debit card completely free of charge before August XX via http // lihi1.cc/13Dbo,nl,Fraud,credit/debit card
Rabobank Your debit card will expire on XX-XX-XXXX Replace your current debit card free of charge via split.to/new debit card,nl,Fraud,credit/debit card
LLOYDS A new payee have be au thorised on 24/11/2020 at 20:05 If you DO NOT recognise this please visit http //verify-device.help,en,Fraud,account alert
Hi Election special X Lac sm XXXX X Lac voice call XXXX X Lac bulk WhatsApp XXXX IVR XXXX Data free Website free Call XXXXXXXXXX Clik bit.ly/2LkgXAL,en,Ads,promo
"Control your security with Fidelity ADT 'S SecureHome mobile App PLUS FREE rental alarm worth R6,500 Reply A for info C to opt out Fidelity ADT Auth Dealer",en,Ads,promo
XX We be unable to process your late bill In order to avoid fee please update your payment information via http //o2.uk.bill337.com/ XX X,en,Fraud,account alert
Your CPR have be expire from the BenefitPay record So please update your CPR again immediately in your BenefitPay Account click here http //bit.ly/3fH5Xk1,en,Fraud,account alert
quot OFFICIAL MESSAGE quot Congratulations You be the winner of LAZADA MILLIONAIRE 2nd prize Rp,id,Fraud,prize
Congratulations you have become a winner in the X st prize by Amazon company this valid for X day Contact +917003207129 t C onlineluckyshoppingdraw.in,en,Fraud,prize
Congratulations to you SIM CARD owner 08121062xxxx M get a GIFT Cash Check Rp 75jt From PT.M KIOS PIN 5N939F7 U Information Click on undian-isiulang.net,id,Fraud,prize
easy to borrow keh1dupafn yaung 1eb1h balk k11k http //bit.ly/2w710DW,ms,Ads,loan/gamble
I be a Tkw Migrant Worker in Debt Receivable Assistance by Kyai H.Yusuf My debt be pay off All Islamic Pesugihan Tampa Tumbal Wa XXXXXXXXXXXX,id,Ads,other
BUNQ We have place your account in the quot quarantine zone quot You must confirm your device before XX-XX to avoid blocking s93.top/BUNQ,nl,Fraud,account alert
We would like to notify you that you have an outstanding vehicle tax refund of £ XXX from an overpayment http //dvla.co.uk.vehicle-tax-refunds .org dvl,en,Fraud,tax refund
"Reliable Finance With Car Truck BPKB Easy Fast Can Over Rate 0,8 month Call.Yanti XXXXXXXXXXXX XXXXXXXXXXXX",id,Ads,loan/gamble
Hi I be TOBI from Vodacom Your Acc XXXX be due on 2020/12/01 for R. XX To pay or manage your account reply ACC or use WhatsApp click http // wa .me XXXXXXXXXXX text manageaccounts Stay Safe Vodacom,en,Fraud,account alert
Dear customer your SBI credit card reward point worth INR XXXX expire by tomorrow Kindly redeem your point in cash by click here https //bit.ly/ 2nbPmvP,en,Fraud,credit/debit card
Dear Customer Your PTM eKYC have be expire today please call customer care no XXXXXXXXXX immediately your PT M account Blocked 24hrs THANK YOU,en,Fraud,account alert
BOSQQQ Congratulations to you for be select as the winner of the XX million giveaway please chat with the Baim Paula team for the management of the prize wa XXXXXXXXXXXX,id,Fraud,prize
Dear Customer Your _paytm_ Wallet Has be Blocked and Hold Your Amount Please Complete Your _paytm_ KYC_ Contact Customer Care XXXXXXXXXX This message be send from an unknown number,en,Fraud,account alert
NatWest disable your Online Banking temporarily due to unusual activity please restore it via http //nwoolb.online to secure your account,en,Fraud,account alert
KNAB A 3rd party have submit a digital authorization to periodically debit 1325.94 from your account Pay attention Isn XX t this right Then you can refuse the direct debit here g27.top/KNAB,nl,Fraud,financial
I XX m REZKY in BRUNAI look for someone who can take care of my trust so I can send my finance 9.9 billion for the future in Indonesia if you want to help sms me XXXXXXXXXXXX,id,Fraud,financial
We 've notice you have a positive balance 320.7 AUD from last financial year Please verify your information to receive the fund myatoservice.com/3/ ID=,en,Fraud,financial
Dear Customer do get X million rupiah If your loan be successful you will be free forever Click and to download it X app.appsflyer.com/com.easyuang pid gopinjama1 2. http //t.cn/E4MLmls 3. go.onelink.me/r5aa/fdf6adf1 For more info contact WA XXXXXXXXXXX,id,Ads,loan/gamble
Gebyar Whatsapp you be choose as the best Pln XXXX with PIN XXXXXXXX for info,id,Fraud,prize
Hello Your delivery be be hold at the distribution center Visit the system to receive your order http //ubotej.co/PwXY02c,pt,Fraud,delivery
TAX AUTHORITY Your outstanding debt of EUR € 687.02 with reference DG XXXX have not yet be pay after several reminder On November XX XXXX the bailiff will proceed with a prejudgment attachment You can avoid the attachment procedure by immediately pay the entire amount via iDEAL http // payment request .rabobank.nl payment request id y57H -YMsSzaomSCZNluspw,nl,Fraud,tax refund
Royal Mail Your package be wait for delivery Please confirm the settlement of £ 1.99 on the following link http // royal mail -parcel7386.com/,en,Fraud,delivery
You 've have win 1500rs Google Pay Reward Click now to get Reward http //gppay.live/ewa,en,Fraud,prize
"Capital of IDR 42,000 to become a dealer and win MILLIONS of RUPIAH in Ceme Games at JAYAPOKER http //103.10.200.41 and Play Sydney amp Big-Two Domino-QQ Togel",id,Ads,gamble
Wednesday Jan 9.4 XX PM Customer XXXXXXXXXXXX You Get +1000 Credit Coins amp Unlimited Chat Packages you know Why hasn XX t it be take yet Call XXX XX and choose X to take you can exchange credit,id,Ads,promo
You have a pending Tax Refund from your council To proceed with your application please complete your form via www.citycounciilii.com,en,Fraud,tax refund
Your package be wait for delivery Confirm the payment 2.99EUROS in the following link http //es-areacorreoslogin.com CORREOS,es,Fraud,delivery
Bank of Fukuoka Information on convenient free loan Application be complete on the Web http // www.fukuokabank.co.jp/lp/fl Sid 3D,ja,Ads,loan/gamble
Dear customer your account have be block due to KYC Update within XX hour Please contact customer care XXXXXXXXXX to continue your service.Thank you,en,Fraud,account alert
BELFIUS unusual activity have be detect on your account Verify yourself via http // belfius.deblokkadedesk.info and avoid blocking,nl,Fraud,account alert
KPD.YTH BPK MOM OFFICIAL MESSAGE NEED BUSINESS MODES GUARANTEE KTP AND KK INTEREST X CPAT PROCESS MIN X MILLION XXX MILLION INTEREST WHATSAPP +6285253830828,id,Ads,loan/gamble
Apply for your new Rabobank debit card and prevent your current debit card from be block via the Rabobank website X.co/,nl,Fraud,credit/debit card
Warning Your Spotify account have expire Activate X month Spotify Premium Now Click here,sv,Fraud,account alert
TAX SERVICE ALERT Your outstanding debt with reference H971 have not be pay after several reminder On Tuesday October X XXXX the bailiff will proceed to prejudgment attachment on your household effect You can prevent the attachment procedure by immediately pay the entire amount via your payment link Feature-H971.nl,nl,Fraud,tax refund
Wednesday April X XXXX Rosa take COVID19 SNS test confirm your zip code Your health first promosms.eu/ Ip20 XXXXXXXXX Covid19,pt,Fraud,covid
Dear you have XXX Points leave in your Biryani By Kilo account Redeem them bit.ly/ BBKorder or on APP bit.ly/ BBKapp STOP http //lmty.io/2J4ia3,en,Ads,promo
serve fast 5-500JT loan throughout Indonesia without collateral PT GUNA PRIMA DANA wa.082190959354,id,Ads,loan/gamble
ING Dear ING customer Download the new ING app with renew certificate now and make the most of it Log in to My ING and follow the step linksplit.io/app-ing,nl,Fraud,account alert
You can help to clarify the truth Telepathic transmission of information be it possible 2nd Global Experiment PYRAMID join free http //allatra.tv/en/znaki 12:21,en,Ads,other
Tax authority Your outstanding debt with reference B901462 have not be pay after several reminder Prevent confiscation and pay via tiny.cc/B901462,nl,Fraud,tax refund
Darty Card Expenses E 160.00 withdrawn in cash by default For another choice of reimbursement answer YES to this SMS before 01/14,fr,Fraud,financial
Order FR18716159 Delivery failure We have try to deliver your package without success Please re confirm your address http // 5ga.us/3UyPhE,fr,Fraud,delivery
Hi ESAKKI RAJA need help in read the monthly statement of your Bajaj Finserv RBL Bank SuperCard XX8147 Chat with Ria to understand the important detail mention in your statement click http //bit.ly/2NXN78,en,Ads,promo
Dear customer your SBI card point worth INR XXXX expire by today Kindly redeem your point in cash by click here http // cardssbi.com/,en,Fraud,credit/debit card
SBI Your Account Is Locked Please Go To https //s.id/vutvy To Unlock,en,Fraud,account alert
the loan you apply for it only take a few step the money will be disburse instantly Come on kilk1 go.onelink.me/ app 58792d X t.cn/EUITKOd X go.onelink.me/c3B9/db231e83 X t.cn/ EUJCK5x X app.adjust.com/sk7b80h X j.mp/2EnO8ne X t. cn/EUJmYbQ More info Call WA XXXXXXXXXXXX,id,Ads,loan/gamble
Your ING Banking App expire on 25/06/2020 03:52 To continue use this service you can update your registration via inlog-Ing.nl,nl,Fraud,account alert
GOOD NEWS Jio have Announced today to give 25GB data with free call daily for X Months Download to activate offer Link http //tiny.cc/MY-JIO-4G,en,Fraud,other
ONLINE FUND LOAN SERVICE throughout Indonesia from XX to XXX million how to apply wa XXXXXXXXXXXX,id,Ads,loan/gamble
Dear User your SIM Verification be Pending Please call our customer Service for offer XXXXXXXXXX Your Service will be Blocked within XX Hrs,en,Fraud,account alert
UPTO RS X LAKH OFF On Popular Used Cars India 's Biggest Car Mela DROOM XX-XX Sept Hurry Buy Now http //goo.gl/N8uSjc Call Free -XXXX XXX 0707eder do n't support reply,en,Ads,promo
Great profit Continue SBIN Sell XXX Booked XXX TataElxi Sell XXX book XXX Bnknfty 28000PE Buy XX Booked XXX Same Call CL WP XXXXXXXXXXX Sushmita,en,Ads,promo
ARGOS Congratulations you 've win the £ XXX gift Do n't miss out Your gift be valid until Sun 9th February http //bit.ly/ ARGOS O,en,Fraud,prize
Hello Confirm your delivery credential today otherwise your package will be return http //Ojo.us/98e9c Ref Number Amazn03321,es,Fraud,delivery
Dear customer patyam your KYC have be suspend patyam office PH XXXXXXXXXX acount will block with in 24hr,en,Fraud,account alert
FRM BnkOfAmerica Click www.bofa-qhw.com SUBJ Account Blocked MSG XXXX,en,Fraud,financial
Dear Owner an unauthorized device be connect to your online account if you be not you check http //verificacontoing.com,it,Fraud,account alert
For their Refills or Punctual Payments you earn them XXX thousand peso m n X IPhone X for more information call XXXXXXXXXX,es,Fraud,financial
"Slmt Info To You T Select Get Rp Cash 175,000,000.- Dr Lazada XXXX Grand Prize Program ID Code VSG88D9 U info Click www.gebyarundian-ptlazada.ml",id,Fraud,prize
Sorry To Disturb Need Funds For Business DII And Other Needs quot Interest X Min X million XXX million For Whatsapp Info XXXXXXXXXXXX,id,Ads,loan/gamble
Customer XXXXXXXXXXXX your 500MB Data Package Prize +1000 PULSA KOIN Why hasn XX t it be take yet IMMEDIATELY Call XXX XX amp Get 500MB Data Credit Prize 2k/3x/mg,id,Ads,promo
Dear Jakartans now you can be free from worry in maintain your family XX s health in a simple way Click for more detail at bit.ly/AntiCORONA,id,Fraud,covid
Multipurpose Loan Rp50 million 1M Interest X year Without Admin Payment Can Not Over School Fees Business Capital Renovation of house etc info wa085282548588 thanks,id,Ads,loan/gamble
Dear customer your account have be block for security reason You can unblock your block via http // my.ing-reactivatie.info/,nl,Fraud,account alert
"Hi Tia this be Tyler with Yes on F the ballot measure for the June 5th election that will guarantee that renter like you and me get a free lawyer if we ever face eviction With over 40,000 renter evict in the past X year this measure be really crucial for us Will you join me in vote yes on Prop F",en,Ads,politics/election
Special offer COULD YOU PARTNER WITH ME IN AN URGENT TRANSACTION CONTACT ME RIGHT NOW FOR DETAILS EMAIL,en,Ads,promo
Dear Sir We be Multi Pharmaceutical Co. UK We have Urgent Longtime Profitable Business to discuss with you Kindly Reply to tomb2788 gmail .com,en,Fraud,other
PAYTM Dear paytm customer your KYC have be suspended.Paytm office pH XXXXXXXXXX call immediately Your account will block within XX hour Thank you paytm team,en,Fraud,account alert
"IncomeTax e filing require you to click http //bit.ly/ 2Z1pQSs to submit a formal refund request for the remittance of your approved refund of Rs25,290.09",en,Fraud,tax refund
Congratulations The result have come out and your zip code XX have be choose You be X of the X winner gt gt http //h3h.Itd/3,es,Fraud,prize
Be a MILLIONaire at Horaspoker http //103.10 .200.46 with Poker domino qq ceme fighter dingdong amp Cambodia Togel game discount up to XX Register now,id,Ads,gamble
Dear Customer Update your data now for the change of Iban and for Web Security Failure to update will result in the Blocking of Cards and all of its Postal Utilities http // update database .com,it,Fraud,account alert
Want to win a Samsung Note 10+ just by redeem X POINT Reply to this SMS type OK. SKB,id,Ads,promo
get get a loan Online XX million 1M low interest fast process no complicate acc XX minute after file amp admin receive u info WA XXXXXXXXXXXX,id,Ads,loan/gamble
The PlayStation X Just Dropped- You 're Chosen As Today 's Winner Snag It By Tonight XX XX- http // wedspswin2.com/r4z/btghhlk,en,Fraud,prize
Dear PAYTM customer your Paytm KYC have expire Contact customer care No XXXXXXXXXX immediately your account will Block within XX hr Thank you PAYTM TEAM,en,Fraud,account alert
hilmi who be hold your hand in this photo be your boyfriend huh d08.co/s/ di2zao,id,Ads,other
If you just imagine your face be fun let alone be able to chat with you uhh it must be fun please call this my active number n08091401029 NO SEX amp SARA ready ya ..,id,Ads,other
Your NETFLIX Subscription have be SUSPENDED to return to be part of our service update your payment method here http //netflix-activa.com/,es,Fraud,account alert
Optus We still do n't hear from you To avoid service restriction please visit http // account.optus billing.services/ to confirm your detail,en,Fraud,account alert
Last Official Notice.Congratulations For you to get a LAZADA BIRTHDAY XXXX prize of Rp XXX million CODE ID VSG88D9 Info Click www.ptlazadaindonesia.tk,id,Fraud,prize
Rabobank Your current debit card expire for use on XX-XX-XXXX Replace your debit card for free via split.to/Betaalmiddel-ververen,nl,Fraud,credit/debit card
BBVA now contact XXXXXXXXX to desist from the seizure of your salary or pension Regularize your ID in the ES80 account XXXX XXXX XX XXXXXXXXXX concept,es,Fraud,financial
Dear customer your Bsnl Number have be Closed for XX hrs please submit Addhar please call customer care XXXXXXXXXX immediately,en,Fraud,account alert
Your My ING payment account have be block for security reason Log in now and verify your Mijn ING via the website X.co/MijnING,nl,Fraud,account alert
We have try to deliver your LP995215701FR package but there be no postage Follow the instruction here 6j5.nl/sclr5,fr,Fraud,delivery
Earn 30K to XXXXX pri month Set up Paper Plate Paper bag Tissue paper Machine Business at home Free Raw Material Buy back Agreement training 's cl XXXXXXXXXXX,en,Ads,promo
"TAP Air Portugal Subscribe to Globo Premium and earn 7,000 mile to use on your trip Offer valid until June 30th http //bit.ly/2JOEz4q",pt,Ads,promo
Rappi Temuco the account We Denied 700.mappiorocito peremete pieleedeelte quierostoruotu storten XX 5ORM TAD XXXXXXX,es,Ads,other
Official message from ARS Grand Est you have test positive for the Covid-19 virus You have therefore be ask to respect isolation Personalized monitoring be offer to you http //ars-grand-est.exolis.fr/ app t XXXXXXX 6675fb1d35fe87 e170adbc2155f3f82e,fr,Fraud,covid
Dear consumer this be a confirmation receipt for online payment of Rs 759.500 txn chgs extra against Refill book ref no XXXXXXXXXX,en,Fraud,financial
SLMt No whatsapp Anda Men dptkn Rp.175.000.000 PIN D330879 cek di bit.ly/info-resmi37,ms,Ads,promo
Rabobank Your debit card be outdated and will expire in X day Request the renew debit card for free now via http //lihi1.cc/Bp3Qr/Pas-Info,nl,Fraud,credit/debit card
I get 4m bonus from this app X new-re.com/zpwshSd X http //t.cn/EfQMID X http //bit.ly/2tQIAY,id,Ads,other
Dear customer Your State bank of india account have be suspend Please Aadhaar card update in your account click here link http //is.gd/ mYPJkw SBI,en,Fraud,account alert
Only XX of WA 's GST go to WA thanks to Libs Lab Keep XXX of WA 's GST in WA Vote X United Australia Party Clive Palmer Auth http //bit.ly/ 2QİGAUM,en,Ads,politics/election
Dear user your bank card have be block Because you have not update yet if you want to keep use your ATM card please call this number,en,Fraud,credit/debit card
Rogers msg Just for you Get iPhones from X when you add a new line on a X yr term to your family 's Share Everything plan Plus save an additional XX mo get a bonus 1GB shareable data Call X XXX XXX-XXXX or hurry in to your local Rogers store this weekend Offer end Feb XX Reply STOP to opt out of Rogers text msg Reach us at http //rogers.com/contactus,en,Ads,promo
Your wallet have be credit with Rs XXX NMS cash Come back to Netmeds and use it to shop for med and more Expires in 48hrs T C http //nms.care/50k_w6m,en,Ads,promo
