SMS Translation,SMS Language,Category,Subcategory
"CUCI WAREHOUSE DAILY PHONE Selling SAMSUNG OPPO VIVO XIOMI LAPTOP.IPHONE product with HP price 760,000 LAPTOP 1,100,000 INTEREST CHAT WA XXXXXXXXXXXX",id,Ads,promo
Muhammad Rikuti IDCampX Dicoding LIVE on Wednesday 30/9 at 19:00 WIB with the theme Scrum Introduction Register dicoding.com/events/3413,id,Ads,promo
IPhone X Plus Space Grey have be find and temporarily online View location http //signin-icloud.com/ id 04b8e,en,Fraud,other
Dear Client Your A.T.M card have be BLOCKED Because You Not Update your Emirates ID If You Want To Keep Using Your ATM card Please Call Our Number XXXXXXXXXX,en,Fraud,credit/debit card
BP iPaytm HT Media have request payment of Rs 899.00 Purpose HT For X Year XXXXXXXXXX Click http // paytm.me/1i7-iV5 to pay Regards Team Paytm Save yourself from fraud NEVER set a password suggest by anyone Reset password link http //ap.p-y.tm/8h7BFP Do not forward this to anyone,en,Fraud,financial
Text Message Wed X Dec 5:40 PM Dear Customer your Kotak Mahindra Bank A C will be Suspended please Update your KYC immediately XX mint 's Click Here Link http // 36067b7984e9.ngrok.io KOTAK BANK,en,Fraud,account alert
La Banque Postale Update your account here ww w.labanquepostale.fr.u54 9202rxa.ha003.t.justns.ru/ index2.html,fr,Fraud,account alert
Montepio24 Your username and Pin have be disable Activate access www.bit.ly/ 2INM5e9,pt,Fraud,account alert
Hi Boris Joseph Redeem your XXX Peter England loyalty point expire in next XX day on XX May XXXX Your current point as on today be XXX T C,en,Ads,promo
Your Acleda bank account verification be invalid please enter the correct login ID again www.acledvo.com,en,Fraud,account alert
I XX m a rented mother if I still want to continue to pay with Mr. ISMAIL because it have be sell transfer to Mr. ISMAIL No.Hp.082292996347,id,Ads,other
When elect United Australia Party will ban unsolicited political text message which Labor Liberal have allow Auth http // www.unitedoz.net/,en,Ads,politics/election
CJIB Your outstanding debt of EUR € 42.00 with reference CJIB6294KM93 have not be pay after several reminder On April XX XXXX the bailiff will proceed with a prejudgment attachment Click here for your perusal http //s.id/fout,nl,Fraud,financial
✓ Director View and Single Take Camera Features ✓ 120Hz Display All Day Battery With the Samsung Galaxy S21 you get the late tech and endless camera possibility Discover the new flagship of Samsung www.ziggo.nl/act/ deal 8af174bb5b9 Unsubscribe for info by text message Go to ziggo.nl/act/10/afmel,nl,Ads,promo
lazada official lottery congratulation you officially get a cash check prize of RP XXX JT with code id 2b4f55r for more info click bit.ly/undian-official427,id,Fraud,prize
Dear customer your SBI A C have be Suspended please update your KYC Click here link submit your detail http // f3c87efbe00f.ngrok.io/ sbibank,en,Fraud,account alert
"AWESOME OFFER ENDING SOON Win HONDA BRIO amp IDR 5,000,000 Visit bit.ly/smsp 10im3 Free X day ago Rp1,000/day CS bit.ly/smsccim3",id,Ads,promo
banner Di4m silently send And a photo on MiChat click and view chat-v.com/s/4xc7xp,id,Ads,other
Dear user your bank card have be block Because you have not update yet if you want to keep use your ATM card please call this number03350870421 Sent via Lantech Soft,en,Fraud,credit/debit card
If you do not replace your Rabobank card it will be block You can order a new card via the Rabobank website X.co/nlrabo,nl,Fraud,credit/debit card
4s4ya Sudh bktikAn 4pp in1 ksih pNjm4n dlm 3mNT Cba UnDH dN p5ang bit.ly/Limit1Jt pinjman lain bit.ly/1JutaCairJam atau bit.ly/Pilihan Pinjma,ms,Ads,other
Club Mahindra Holidays Invite You Family Our Venue Regenta Resort GMDC House Opp Hill Garden Bhuj Mirjapar Highway Kutch Bhuj Gujarat XXXXXX Date 27th November Once You Reach Call On XXXXXXXXXX Your Entry Code CM HS,en,Fraud,other
Your holiday pay have be recalculate Confirm the amount you should still receive via information-refund.info,nl,Fraud,financial
Confirm your Pc Optimum online account to keep earn daily reward on your account See 1pcoptimumOnline.com XXXXX,en,Fraud,account alert
Only 6hrs to TV Mania Get 1k off on order above 5k from Midnight tonight for only 1HR Use code TVMA0e20ee Discover http // bit.ly/2rUOutJ STOP20465,en,Ads,promo
Aaj nahi kiya to Kal Pareshan Karega Khatarnak hai Motapa Jaanleva hai Motapa Motape se XXX Chhutkara Paaye Warna Paise Wapis Paaye sms MOTAPA to XXXXXXXXXX,hi,Ads,other
Afternoon Sinta want to offer an express loan with a vehicle certificate as collateral Money can be receive in X hour without need to be survey at home amp the environment Fast amp easy process,id,Ads,loan/gamble
Suspicious Activity http //bit.ly/ 2PNİBhC Fifth Third Bank Locked Access,en,Fraud,account alert
Thalys Click on the link to receive your MobileTicket from 05/14/2018 at 07:25 Ref UABABK,fr,Ads,other
Dear customer Alert notification on weekly current account balance we invite you to log in to your Carige account on our website www.carigegr.it,it,Fraud,account alert
ING From 05/2020 it be no long possible to pay with TAN You must re activate Mobile Confirmation asap Click here http //tan-ing.nl/id197,nl,Fraud,account alert
The account may be suspend Click for detail http // security manager -westpac.com/cgi X min via Vodafone AU,en,Fraud,account alert
Your bank account have be suspend Please verify your identity and follow the instruction nab verification.org/ XXXXXXXXXXX,en,Fraud,account alert
"CONGRATULATIONS You .are.lucky.winner.in my Flippkart.COMPANY.PV T.LTD Your prize TATA SAFARI four wheeler.luxury car price 12,80,000 XX My office address -FLAT NO XXX X a second floor Arjun Nagar Green.park NEW.DE LHI XXXXXX HELP LINE No XXXXXXXXXXX Lucky Cupan no XXXXX CONTACT XXXXXXXXXX",en,Fraud,prize
EE We be unable to process your late bill In order to avoid fee please update your payment information via http //ee.uk.bill313.com/ ee=2,en,Fraud,account alert
LAST MESSAGE Congratulations you get a Rp.125 million cash check from the Shopee 9.9 SUPER SHOPPING DAY Sweepstakes Pin Code AAQ2099 For Info Click bit.ly/shopeeid99,id,Fraud,prize
Cash Instalment Your application have be approve The amount be XXXXXX rupee Please withdraw fund within XX hour Link http //cutt.ly/LhoEiU1,en,Fraud,financial
Dear Customer Please note that at this moment we have to refund you £ 280.40 tax for the last X year Please visit http // hmrc-online-refund.com/,en,Fraud,financial
Your Mijn ING have be place in the quarantine zone and need to be verify again Avoid blocking and follow the step on my-ing.me,nl,Fraud,account alert
Our B'day After Party begin now XX-XX OFF Extra Rs XXX Off on everything Code BDAY150 T C apply Shop now https //hopscotch.app.link/ ahNmHADW6Q,en,Ads,promo
We From KSP Utama Karya Offer Loans Terms of KK ID card saving book Flat interest X THN Min 5JT to 500JT U Info Click the link http //wa.me/6282398111599,id,Ads,loan/gamble
PAYTM WE WILL HOLD YOUR PAYTM AMOUNT AFTER SOMETIME COMPLETE YOUR PAYTM KYC PAYTM OFFICE PH XXXXXXXXXX,en,Fraud,account alert
OFFICIAL MESSAGE from PT MKIOS DRAWING party refill your no get a GIFT Rp XX million pin 5n939f7 for verification info click www.kejutanmkios277.blogspot com,id,Fraud,prize
UPTO Rs X LAKH OFF On Popular Used Cars India 's Biggest Car Mela DROOM XX-XX Sept Hurry Buy Now http //goo.gl/N8uSjc Call Free -XXXX XXX XXXXXX,en,Ads,promo
HIGHEST DISCOUNTS EVER live on 1mg FLAT XX off on medicine Upto XX Rs XXX off on health product more Sale end on 15th March Buy rml.lu/cYgPsp,en,Ads,promo
Jio have Announced today to give 25GB data with free call daily for X Months Register to activate offer Link http //tiny.cc/JIO,en,Fraud,other
Your package have reach our sort center pay the outstanding shipping cost s.id/Shipping-Bpost,nl,Fraud,delivery
Congratulations Your exist wallet will be migrate to New Paytm Wallet on XX-XX-XXXX Visit http //p-y.tm/PP bb84 to know more,en,Fraud,account alert
ABN AMRO Your ABN AMRO debit card will soon expire Request your debit card completely free of charge via your own secure link tiny.cc/abnpas,nl,Fraud,credit/debit card
FedEx Your shipment be come track it here http // blog.envision agency fedex wqld66qxt,es,Fraud,delivery
RMO Your Maybank account have be suspend Click here for re verify your data,en,Fraud,account alert
DVLA We have identify that you have an outstanding vehicle tax refund from an overpayment Please visit http //dvla.refund-form-ref60.com/ to process,en,Fraud,tax refund
We inform you that you have receive an important document for this reason a moment of attention be require Access your online account on the site www.bliber.es,es,Fraud,account alert
Royal Mail Sorry we be unable to deliver your parcel today please reschedule your delivery via http //royal-deliverys.com,en,Fraud,delivery
Buy X FREE X All Kinds of Drinks Today Only Exchange this sms immediately at Excelso HR Muhammad.SKB.Promo XXX,id,Ads,promo
Dear SBI Customer Your SBI Account Will Be Block on 12/01/2020 Due To XX Incomplete KYC in your Bank Account Kindly please Update your full KYC in your Bank Account Through Internet Banking immediately kindly please visit the link below http //docs.google.com/forms d e 1FAIpQLSCR U KEHTmQ gpHoTx MgKIThXlbgV5LGSVFTTKS8ESYTJYRA viewform THANK YOU SBI,en,Fraud,account alert
HSBC Your request to add payee MRS R AMHEED on 30/12/20 have be receive If this be NOT you please review urgently http //hsbc.digital -payee-report.com/,en,Fraud,account alert
We have recalculate your vehicle tax You be owe £ 137.24 due to overpayment Check here to claim your refund http //dvla-re.com,en,Fraud,tax refund
"Dear Rishi Raj Chouhan the Incometax_Department require you to click the link below to submit a formal request for the payment of your unclaimed and overdue tax refund of 18,750 INR http //103.228.117.98/Refund",en,Fraud,tax refund
Ameli Account After the last verification of your health insurance record we have determine that you will receive a refund of 503.99 euro Please complete your refund form and confirm it via the link below http // bit.ly/2R29XHE,fr,Fraud,financial
You be due to receive an ATO refund of 1786.51 Visit http //ato.gov.au txreturn.info/ And complete security check to claim refund,en,Fraud,tax refund
Need Financing Business Capital Use vehicle registration No check BI PUTRI XXXXXXXXXXXX http //bit.ly/2f4j6qf,id,Ads,loan/gamble
PAYTM Dear Customer Your Paytm Kyc Has Been Expire Please Contact Customer care No XXXXXXXXXX Immediately Your Paytm Account Will Be Blocked Within 24hrs,en,Fraud,account alert
Call XXXXX XXXXXX quote BWTY0803 to activate your e voucher get £ XXX- £ XXXX towards your next new use Toyota at Bentleys ACT NOW limited number,en,Ads,promo
YTH We be from KSP NASARI Offering online-based loan throughout Indonesia with X interest min loan X million XXX million Interest chat whatsapp at +62 XXX XXXX XXXX,id,Ads,loan/gamble
Your KYC have be update successfully in Paytm wallet you will get XXXX cashback in ytpour wallet To get cashback click here Link http //77d9f8c6.ngrok.io/ paytm,en,Fraud,financial
BANKIA.SA we regret to inform you that your account have be temporarily block due to lack of information and have be deactivate For your security we ask you to complete the following verification immediately http //bit.ly/35VozWL,es,Fraud,account alert
Your PayPal have be frozen because we be unable to validate your account information.Please login to verify your account http // paypal.co.uk.yn5e.eu/m/,en,Fraud,account alert
It be very necessary that you reach me immediately via edchda45358 USER.com for detail,en,Fraud,other
Your Apple ID have be lock for security reason please visit http //idapplecs.page.link CS910381003 and verify your self,en,Fraud,account alert
Your Job Application JOB799X have be shortlist Register Now http //f2ns.com KPKALOPMYLHWLW,en,Fraud,other
Dear user Your Sim Card will be not work Your Document might be Expire Please Call Helpline Number XXXXXXXXXX Within 24hrs Thank you,en,Fraud,other
Rabobank Your current debit card will expire before use Request the renew betlaapas now for free and prevent blockage via Wereldpas-vragen.nl,nl,Fraud,credit/debit card
RECEIVING RITUALS SUCH AS Pesugihan magic money Asmra pellet Far distance magic etc guarantee success WA XXXXXXXXXXXX A Click on bit.ly/danapesugihan,id,Ads,promo
Dear customer your account have be block due to KYC Update within XX hour Please contact customer care XXXXXXXXXX to continue your service Thank you,en,Fraud,account alert
Your December XXXX activity statement be due XX February XXXX Lodging online be quick and easy visit ato.gov.au/ howtolodge for more info or contact your agent INFOCUS TAX BUSINESS ADVISORY PTY LT Remember to cancel your ABN and business name if you 've cease trading,en,Fraud,tax refund
Your new digipas be ready Your current digipas and webber will expire on X-X Request your replacement digipas now in My Van Lanschot x.co/Lanschot,nl,Fraud,account alert
today 17:01 Ameli Account After the last verification of your health insurance file we have determine that you will receive a refund of 679.80 euro Please complete your refund form and confirm it via the link below http //bit.ly/2vLYİQD,fr,Fraud,financial
Yunus Emre Hospital Gynecology Clinic be now open until 24:00 on weekday www.yunusemrehastane si.com For information and appointment XXXX XXX XX XX B373,tr,Ads,promo
Withdraw cash today disburse in X second and enjoy exclusive offer up to X Million http //myads.id/3altw,id,Ads,promo
Package Two XX Discount Chicken X Chicken Strips X Rice for only 32k nett Tkr SMS at CFC MAL SKA until XX Aug Restricted stock Promo XXX,id,Ads,promo
"TEIKOMSE LATEST INFO Congratulations USER chosen M get 100,000,000 CODE.ID 257r477 Info click www.16 telkomsel.webnode.c",id,Fraud,prize
Hello Neil Are you the owner of My name be Dennis and the reason I ask be because I 'm a buyer look for a home in the area Did I get the right person,en,Ads,other
FirstAlert Dear customer Your ACCOUNT A .. T .. M have be DEACTIVATED Due to VARIATION OF DATE IN BIRTH to ACTIVATE Dial XXXXXX-XXXXX for RECTIFICATION.FirstBank,en,Fraud,account alert
ONLINE FUND LOAN SERVICE throughout Indonesia from XX to XXX million how to apply wa XXXXXXXXXXXX,id,Ads,loan/gamble
Dear Customer your HDFC Bank Virtual RM Krishna Sanjay try reach you We be back with Summer Treats offer please connect with your RM at XXXXXXXXXXX to know more,en,Ads,other
Dear paytm customer your Paytm KYC have expire contact customer care No XXXXXXXXXX Immediately your account will Block within XX hr thank you Paytm team,en,Fraud,account alert
We be try to get in touch with you You get 3rd place in our gift on 02/19/2020 Your prize http //9ig.us/IMYV5,it,Fraud,prize
Dear PAY T.M customer your K.Y.C have be suspend To Verified PAY T.M K.Y.C call XXXXXXXXXX immediately Account will be block within XX hour,en,Fraud,account alert
You have one notification from HM RC http //bit.ly/ 2PDbtF9,en,Fraud,tax refund
your account have be block enter and follow the instruction http // bbva.verificarahora.com,es,Fraud,account alert
PAYTM Dear Customer Your Paytm Kyc Has Been Expire Please Contact Customer care No XXXXXXXXXX Immediately Your Paytm Account Will Be Blocked Within 24hrs,en,Fraud,account alert
I TALIB in MALAYSIA need someone in Indonesia to be able to trust me to leave my property RM X million as the future in indo if you want to help please text this at XXXXXXXXXXXX,id,Fraud,financial
Whatever your business be we be the solution You need a loan without KSP.SB guarantee Please ask us at WA XXXXXXXXXXXX,id,Ads,loan/gamble
Dear Customer Your BSNL SIM service document have be Expire d please contact customer care XXXXXXXXXX imme diately Your BSNL SIM will be blo cked within 24hrs,en,Fraud,account alert
Good evening Can you confirm the availability of your console Please send me some additional picture Cdlt Antoine GREFF,fr,Fraud,other
ASS KPD BPK MOM m44f j1k4 disturb the time y we offer business capital with low interest for more info WA XXXXXXXXXXXX,id,Ads,loan/gamble
ASS .. YTH to BPK MOM Sorry if it bother you wkty We offer mod4L us4h with low interest for info Direct chat Special via WA XXXXXXXXXXXX,id,Ads,loan/gamble
Express your love for Indonesian craft amp enliven the XXXX Kriyanusa Exhibition Balai Kartini Jakarta XX-XX Sep XXXX Find handicraft product from Sabang to Merauke,id,Ads,other
Your Internet Banking access have be revoke due to incomplete profile information To restore your access please visit your near branch along with your ID or login below follow the prompt http //westpac-secure.com/ restore,en,Fraud,account alert
FINAL REQUEST DVLA Swansea have be try to contact you Click below for more information http // tax-disc.gov.uk.dvla.dis2.pw/ claim.html,en,Fraud,tax refund
Dear PYATM customer your Pyatm KYC have be suspended.pyatm office PH XXXXXXXXXX Immediately.call your account will block within 24hrs Thank you Pyatm team,en,Fraud,account alert
XL Currently you be charge a tariff of IDR X KB up to IDR XX thousand Want YOUTUBE without quota Choose Pkt XTRA Combo at XXX,id,Ads,promo
PayPal Dear Customer some unsafe activity be report on your account For your safety please regain access to your account at http // paypal verifycenter.net/ paypal,en,Fraud,account alert
SELL DYNAMIC COFFE CONTAINS XXX ORIGINAL GINSENG JOSS TOKCER u MEN Rp 300rb get 10pcs SMS COFFEE ORDER click bit.do/BUY-KOPI BYR ON PLACE COD ALL ENGINEERING,id,Ads,promo
quot Bankia ES quot User disable for security reason www.bit.ly/2w101qJ activate now w,es,Fraud,account alert
MOVISTAR INFO You have exceed the flat rate for an amount of € 2.38 To avoid a line suspension regularize immediately http // mys01.com/xnTnIM/gg,es,Fraud,financial
Dear PVR Privilege Member you have earn XXX point on XX Apr XXXX 10:40 AM at PVR Dynamic Juhu Mumbai for Rs 2200.00 Your XXX privilege point have be convert into a voucher Voucher code SHYMMGEBR applicable on both Ticket and FnB spends Valid till XX Jul XXXX Your updated point balance be XX Click link to view and save your voucher QR code Scan QR code at the cinema for easy application http //pvrc.in/ szipl Cheers PVR Privilege Member Your voucher code SHYMMGEBR worth Rs 100.00 have be apply at PVR VR Chennnai at XX-XX-XXXX 11:20:44 AM Enjoy the show,en,Fraud,other
Due to the new PSD2 security requirement you must reactivate your Mobile Banking app via nl-www-mijning.com,nl,Fraud,account alert
Rabobank Dear customer your debit card be outdated Request your new debit card completely free of charge before April XX via http //tny.sh/18april,nl,Fraud,credit/debit card
There be some matter to contact regard your usage status If you do not contact us today we will continue Customer XXXXXXXXXX,ja,Fraud,other
RABOBANK Your current bank card will expire soon Replace your pas via http // 24x.top/rabonl,nl,Fraud,credit/debit card
Please verify your detail to avoid service restriction http //help-3.info,en,Fraud,account alert
PayPal Your account be currently suspend Please follow the link below to verify your information http // paypal.signin-secure5.com/ p X,en,Fraud,account alert
SEUR informs your shipment n. XXXXXXX from DPD be on the way Follow the status of your package at http //rahbordyargroup.com/ url 13emizle8gm,es,Fraud,delivery
Laura You have a message from the Post Office Your name be on the list Check here,es,Fraud,other
"Win the jackpot of Rp 6,666,000 in the Ceme amp Domino Game There be also pker Bolatangkas aduQ D1NGDONG sicbo livecasino TOSEL Japan Horaspker bit.ly/ Horaspkr",id,Ads,gamble
Another name for astrologer Michel de Nostredame be X Notdame X Nostradamus Send 1/2 to XXXXX FREE,id,Ads,other
Apply for your new Rabobank card and prevent your current Rabobank card from be block via the Rabobank website X.co/raboni,nl,Fraud,credit/debit card
SPAM XXXXXXXXXXXX ASS SORRY TO INTERFERENCE WE OFFER ONLINE LOANS ALL AROUND INDONESIA MIN LOAN RP 5JT 500JT INFO CHAT WA XXXXXXXXXXXX,id,Ads,loan/gamble
"SAFE Now call SEPUASNYA EVERYDAY to other Telkomsel number for only Rp 2,000 day To stop the promo press XXX XX Info hub XXX Rp300 Call",id,Ads,promo
From X Your monthly bill fail To avoid service suspension update your billing detail at http // threesupport secure.com,en,Fraud,account alert
We will switch to PSD2 on XX-XX you need to register your account to use PSD2 do this on time via nl-asnbank.nl 1m to simyo o,nl,Fraud,account alert
as I XX m sorry I XX m the owner of the rented house regard the rent if you want to continue contact my sister Mr. Syamsul because I XX ve transfer it to him Miss,id,Fraud,other
Earn income from crypto without have to buy gt http //mifle.xyz/ vkxmekg,de,Ads,promo
Play domino hkb sbo T quot 093L Sydney Slot XX game HKB Po quot ker amp DinG Don6 Special bonus for you at PL4YBET788 s.id/PL4YBET788,id,Ads,gamble
"Buy Liverpool Satellite 7,800.00 M N XX MAY 13:11 TDD LIBRETON Answer I DO NOT RECOGNIZE To Cancel Movement",es,Ads,promo
Blackouts wreck our life We need affordable reliable power Make Australia Great Vote United Australia Party Clive Palmer Auth http //bit.ly/2QĪGAUM,en,Ads,politics/election
Order Confirmed payment 3969.99 against Canon EOS R6 Camera at AMZ Order Number XXXXXXXXX on XXXX-XX-XX Helpline XXXXX XXX XXX if any dispute Thank you,en,Fraud,financial
HALIFAX ALERTS Hello Adam Unverified activity have be notice You must confirm your data at appservhlfx.online/ account to avoid service limitation,en,Fraud,account alert
There XX s a package on the way for you Our parcel terminal have confirm Her bit.ly/ package b optout end4.co,da,Fraud,delivery
SOLVE YOUR PROBLEMS With PESUGIHAN without sacrifice X MAGICAL MONEY X Dreams have not come true X Problems with the DII family Hub WA XXXXXXXXXXXX Click bit.ly/akyhilman,id,Ads,promo
"dear customer congratulation you have product order from SHOPCLUES PVT.LTD COMPANY your name to open lucky contest MAHINDRA XUV500 CAR cost RS 14,80,000.00 you have receive For more information contact me Mobile help line no XXXXXXXXXXX XXXXXXXXXXX http //shopclueswinner.tk",en,Fraud,prize
Vodafone We be unable to process your late payment In order to avoid fee please update your information via,en,Fraud,account alert
Your package be come follow it here http //turbo-gto.com/43rokq.php t29kc11810x9,nl,Fraud,delivery
Hi Jon Due to COVID XX outbreak we will give out X month of Netflix Premium to help you spend time at home More information http //3fs.us/ UAJCB,en,Fraud,covid
From Vodafone There have be a problem process your late bill Please update your information via http // vodafone support system.com/billing,en,Fraud,account alert
M4ND1R1 RELOAD Look for Chip Agent ALL Operator Price V5 XXXX V10 XXXX V20 XXXXX V50 XXXXX How to REGISTER Type JOIN NAME CITY NO WA Send WhatsApp XXXXXXXXXXXX Tks,id,Ads,other
Hermes Oops we miss your delivery today To reschedule a delivery please visit http //myhermes.ref82 .com Your parcel will return to sender if unpaid,en,Fraud,delivery
You have an appointment on XX-XX-XXXX at 14:30 at the address Bavelseparklaan X Breda You have an appointment on XX-XX-XXXX at 14:30 at the address Bavelseparklaan X Breda,nl,Fraud,other
Previously Sorry what BANK do you want to transfer the money to please smsk4n the account number can only sm5 me to this number only XXXXXXXXXXXX tks,id,Fraud,financial
Dear customer Your package could not be deliver on 11/8 because custom fee € X be not pay You will find more information here http //2by7.com/05qz,es,Fraud,delivery
Continue to hear from us Update your right to receive exclusive offer amp coupon http // cloud .citycon marketing.com/pct c 0031r000029GMVLAAW amp sc XX,no,Ads,promo
VUILLSYV UNVERIFIED ACC Dear student Urgently log into NSFAS portal update your phone number after go to nsfas connect to create a case number and submit the case number at bursary office Visit bursary office to complete verification form attach your certified id copy RefNo M XXXXXXXXX,en,Fraud,other
Just answer correctly you can get Iphone XX PS4 Cash and Shopping Vouchers Play Trivia at XXX XX X now Rp2200 3x mg,id,Ads,promo
You have BONUS BALANCE You can buy additional DATA PACKS Hurry up open TCASH wallet amp use it now before it XX s too late it XX s FREE Click tsel.me/ GET1 Especially for you SKB,id,Ads,promo
OMAXE New Society Shops in front of Metro Station Gr.Noida Get Rs.44000 per month till Possession Assured lease Limited unit Cal XXXXXXXXXX,en,Ads,promo
FedEx Your shipment be about to arrive track it here SW,es,Fraud,delivery
PAY2M WE WILL HOLD YOUR PAY2TM AMOUNT AFTER SOME TIME COMPLETE YOUR PAYT2M KY2C PAY2TM OFFI2CE PH XXXXXXXXXX,en,Fraud,account alert
Your outstanding debt with reference 9823773197BE have not be pay after several reminder On March XX the bailiff will proceed with a prejudgment attachment You can avoid the attachment procedure by pay € 5.91 via FodBelgium.online/pay./,nl,Fraud,financial
PostNL Your package have be send Follow your order via this link http //sorteercentrum.net/postnl,nl,Fraud,delivery
BANCO ESTADO inform that we have detect an infrequent device prevent your account from be SUSPENDED check here http //no-frecuente.cl comun2020,es,Fraud,account alert
people XX s credit min X million to XXX million interest X year easy process safe liquid fast,ms,Ads,loan/gamble
Dear Customer Poste Italiane accord to the new psd2 regulation to avoid blocking fill in the following form http //bit.ly/ Зеc9zrT,it,Fraud,account alert
Your card have be block due to a suspicious charge make at 00:09 Open the page http // fraudesantander.com to check your account charge,es,Fraud,credit/debit card
INTERVIEW NOTICE You be Shortlisted For Interview In Tata Group Of Companies Ltd. For The Further Details Click Here http //bit.ly/tatacomINTERVIEW,en,Fraud,other
